<?xml version="1.0"?>

<!DOCTYPE MODE SYSTEM "xmode.dtd">

<MODE>
	<PROPS>
		<PROPERTY NAME="commentStart" VALUE="&lt;!--" />
		<PROPERTY NAME="commentEnd" VALUE="--&gt;" />
	</PROPS>
	<RULES IGNORE_CASE="TRUE">
		<!-- SGML comment -->
		<SPAN TYPE="COMMENT1">
			<BEGIN>&lt;!--</BEGIN>
			<END>--&gt;</END>
		</SPAN>

		<!-- JavaScript -->
		<SPAN TYPE="MARKUP" DELEGATE="JAVASCRIPT">
			<BEGIN>&lt;SCRIPT</BEGIN>
			<END>&lt;/SCRIPT&gt;</END>
		</SPAN>

		<!-- stylesheet -->
		<SPAN TYPE="MARKUP" DELEGATE="CSS">
			<BEGIN>&lt;STYLE</BEGIN>
			<END>&lt;/STYLE&gt;</END>
		</SPAN>

		<!-- DTD instructions -->
		<SPAN TYPE="KEYWORD2" DELEGATE="xml::DTD-TAGS">
			<BEGIN>&lt;!</BEGIN>
			<END>&gt;</END>
		</SPAN>

		<!-- markup tags -->
		<SPAN TYPE="MARKUP" DELEGATE="TAGS">
			<BEGIN>&lt;</BEGIN>
			<END>&gt;</END>
		</SPAN>

		<!-- SGML entities -->
		<SPAN TYPE="LITERAL2" NO_WORD_BREAK="TRUE">
			<BEGIN>&amp;</BEGIN>
			<END>;</END>
		</SPAN>
	</RULES>

	<!-- ESCAPE is not exactly right but it is needed to correctly
	     handle JavaScript in on* parameters -->
	<RULES SET="TAGS" DEFAULT="MARKUP" ESCAPE="\">
		<SPAN TYPE="LITERAL1">
			<BEGIN>"</BEGIN>
			<END>"</END>
		</SPAN>

		<SPAN TYPE="LITERAL1">
			<BEGIN>'</BEGIN>
			<END>'</END>
		</SPAN>

		<SEQ TYPE="OPERATOR">=</SEQ>
	</RULES>

	<RULES SET="JAVASCRIPT" DEFAULT="MARKUP" IGNORE_CASE="TRUE">
		<SEQ TYPE="MARKUP" DELEGATE="javascript::MAIN">&gt;</SEQ>
		<!-- handle <SCRIPT SRC="..."> properly -->
		<SEQ TYPE="MARKUP" DELEGATE="BACK_TO_HTML">SRC=</SEQ>
	</RULES>

	<RULES SET="BACK_TO_HTML" DEFAULT="MARKUP">
		<SEQ TYPE="MARKUP" DELEGATE="html::MAIN">&gt;</SEQ>
	</RULES>

	<RULES SET="CSS" DEFAULT="MARKUP">
		<SEQ TYPE="MARKUP" DELEGATE="css::MAIN">&gt;</SEQ>
	</RULES>
</MODE>
